{
  "$schema": "https://json-schema.org/draft/2020-12/schema",
  "$id": "https://huntproxy.local/schemas/plugin-manifest-v1.json",
  "title": "HuntProxy plugin manifest v1",
  "type": "object",
  "additionalProperties": false,
  "required": ["schema_version", "id", "name", "version", "description", "enabled", "entrypoint", "entrypoint_sha256", "capabilities", "limits", "actions"],
  "properties": {
    "schema_version": { "const": 1 },
    "id": { "type": "string", "pattern": "^[a-z0-9][a-z0-9-]{1,62}$" },
    "name": { "type": "string", "minLength": 1, "maxLength": 80 },
    "version": { "type": "string", "pattern": "^[0-9]+\\.[0-9]+\\.[0-9]+$" },
    "description": { "type": "string", "minLength": 1, "maxLength": 300 },
    "enabled": { "type": "boolean" },
    "entrypoint": { "type": "string", "pattern": "^[A-Za-z0-9._/-]+\\.js$" },
    "entrypoint_sha256": { "type": "string", "pattern": "^[a-f0-9]{64}$" },
    "resources": {
      "type": "object",
      "additionalProperties": {
        "type": "object",
        "additionalProperties": false,
        "required": ["path", "sha256"],
        "properties": {
          "path": { "type": "string", "minLength": 1 },
          "sha256": { "type": "string", "pattern": "^[a-f0-9]{64}$" }
        }
      }
    },
    "capabilities": {
      "type": "array",
      "uniqueItems": true,
      "items": { "enum": ["http.semantic", "http.raw", "http.race", "identity.use"] }
    },
    "limits": {
      "type": "object",
      "additionalProperties": false,
      "required": ["max_concurrency", "max_operations", "timeout_ms", "memory_mb"],
      "properties": {
        "max_concurrency": { "type": "integer", "minimum": 1, "maximum": 100 },
        "max_operations": { "type": "integer", "minimum": 1, "maximum": 100000 },
        "timeout_ms": { "type": "integer", "minimum": 1000, "maximum": 3600000 },
        "memory_mb": { "type": "integer", "minimum": 1, "maximum": 256 }
      }
    },
    "actions": {
      "type": "array",
      "minItems": 1,
      "items": {
        "type": "object",
        "additionalProperties": false,
        "required": ["name", "description", "input_schema"],
        "properties": {
          "name": { "type": "string", "pattern": "^[a-z][a-z0-9_]{1,63}$" },
          "description": { "type": "string", "minLength": 1, "maxLength": 300 },
          "input_schema": { "type": "object" },
          "required_capabilities": {
            "type": "array",
            "uniqueItems": true,
            "items": { "enum": ["http.semantic", "http.raw", "http.race", "identity.use"] }
          }
        }
      }
    }
  }
}
