{
  "schema_version": 1,
  "id": "403-bypasser",
  "name": "403Bypasser",
  "version": "0.3.0",
  "description": "Test denied endpoints with safe path, method, forwarding-header, host, and encoding variants.",
  "enabled": true,
  "entrypoint": "index.js",
  "entrypoint_sha256": "99a8f014e0295e73bb4a9713ab2256eb66047cb91af62cee9ffa115a0d801949",
  "capabilities": ["http.semantic"],
  "limits": { "timeout_ms": 300000, "max_operations": 500, "max_concurrency": 6, "memory_mb": 32 },
  "actions": [{
    "name": "scan",
    "description": "Generate and compare authorization-bypass variants for one denied request.",
    "required_capabilities": ["http.semantic"],
    "input_schema": { "type": "object", "additionalProperties": false, "required": [], "properties": { "allow_state_changes": { "type": "boolean", "default": false }, "include_not_found": { "type": "boolean", "default": false, "description": "Also investigate a 404 control, with lower-severity results." }, "success_markers": { "type": "array", "maxItems": 20, "items": { "type": "string", "minLength": 1, "maxLength": 200 }, "description": "Optional protected-resource strings required in an allowed response." }, "failure_markers": { "type": "array", "maxItems": 20, "items": { "type": "string", "minLength": 1, "maxLength": 200 }, "description": "Optional denial/login strings that disqualify an allowed-looking response." }, "max_variants": { "type": "integer", "minimum": 1, "maximum": 100, "default": 50 } } }
  }]
}
